{
  "version": "1",
  "source": "USDA Cooperative Extension (Cornell, WSU, UC ANR, UF/IFAS, OSU, Penn State, Texas A&M AgriLife); SARE Cover Crops field guide; Rodale Encyclopedia of Organic Gardening; USDA-ARS rotation research. Rotation intervals chosen conservatively to break documented pathogen cycles; aggressive rotations may shorten gaps where disease pressure is known to be low.",
  "license": "CC-BY-4.0",
  "lastUpdated": "2026-09-22",
  "entries": [
    {
      "family": "nightshades",
      "scientificFamily": "Solanaceae",
      "rotationYears": 3,
      "crops": [
        "amish-paste-tomato",
        "beefsteak-tomato",
        "black-cherry-tomato",
        "black-krim-tomato",
        "brandywine-tomato",
        "cherokee-purple-tomato",
        "cherry-tomato",
        "chiltepin",
        "eggplant",
        "gardeners-delight-tomato",
        "grape-tomato",
        "green-zebra-tomato",
        "ground-cherry",
        "ground-cherry-aunt-mollys",
        "ground-cherry-clammy",
        "hillbilly-tomato",
        "japanese-eggplant",
        "juliet-tomato",
        "kellogg-breakfast-tomato",
        "mortgage-lifter-tomato",
        "paste-tomato",
        "pepper-aleppo",
        "pepper-anaheim",
        "pepper-banana",
        "pepper-carolina-reaper",
        "pepper-cayenne",
        "pepper-fresno",
        "pepper-ghost",
        "pepper-gypsy",
        "pepper-habanero",
        "pepper-hot",
        "pepper-jalapeno",
        "pepper-mariachi",
        "pepper-mulato",
        "pepper-padron",
        "pepper-pasilla",
        "pepper-peppadew",
        "pepper-poblano",
        "pepper-purple-jalapeno",
        "pepper-scotch-bonnet",
        "pepper-serrano",
        "pepper-shishito",
        "pepper-sweet",
        "pepper-trinidad-scorpion",
        "potato",
        "roma-tomato",
        "san-marzano-tomato",
        "sungold-tomato",
        "tomatillo",
        "tomatillo-purple",
        "tomato",
        "yellow-pear-tomato",
        "early-girl-tomato",
        "better-boy-tomato",
        "celebrity-tomato",
        "rutgers-tomato",
        "stupice-tomato",
        "glacier-tomato",
        "siberian-tomato",
        "sub-arctic-plenty-tomato",
        "japanese-black-trifele-tomato",
        "costoluto-genovese-tomato",
        "pepper-thai",
        "pepper-datil",
        "pepper-aji-amarillo",
        "pepper-hungarian-wax",
        "pepper-cubanelle",
        "pepper-jimmy-nardello",
        "pepper-lunchbox",
        "matt-wild-cherry-tomato",
        "indigo-rose-tomato",
        "principe-borghese-tomato",
        "golden-jubilee-tomato",
        "pineapple-tomato",
        "ananas-noire-tomato",
        "taxi-tomato",
        "jet-star-tomato",
        "mountain-magic-tomato",
        "oxheart-tomato",
        "prudens-purple-tomato",
        "brandywine-yellow-tomato",
        "marvel-stripe-tomato",
        "big-rainbow-tomato",
        "paul-robeson-tomato",
        "aunt-rubys-german-green-tomato",
        "mary-robinson-tomato",
        "opalka-tomato",
        "pepper-tabasco",
        "pepper-rocoto",
        "pepper-pequin",
        "pepper-aji-dulce",
        "pepper-bishops-crown",
        "pepper-buena-mulata",
        "pepper-corno-di-toro",
        "pepper-tepin",
        "pepper-aji-limon",
        "pepper-fish",
        "goji-phoenix-tears",
        "goji-crimson-star",
        "pepper-hungarian-sweet-banana",
        "pepper-tabasco-southern",
        "tomato-eva-purple-ball",
        "tomato-arkansas-traveler",
        "tomato-creole-louisiana",
        "lycium-chinense-medicinal-di-gu-pi",
        "carbon-tomato",
        "cosmonaut-volkov-tomato",
        "cream-sausage-tomato",
        "striped-german-tomato",
        "cherokee-chocolate-tomato",
        "brandywine-pink-tomato",
        "brandywine-red-tomato",
        "german-johnson-tomato",
        "mr-stripey-tomato",
        "white-wonder-tomato",
        "green-doctors-tomato",
        "lemon-boy-tomato",
        "persimmon-tomato",
        "pink-berkeley-tie-dye-tomato",
        "tigerella-tomato",
        "pink-bumblebee-tomato",
        "sunrise-bumblebee-tomato",
        "garden-peach-tomato",
        "riesentraube-tomato",
        "black-plum-tomato",
        "speckled-roman-tomato",
        "box-car-willie-tomato",
        "marglobe-tomato",
        "sun-sugar-tomato",
        "italian-heirloom-tomato",
        "black-sea-man-tomato",
        "earl-of-edgecombe-tomato",
        "lillians-yellow-tomato",
        "anna-russian-tomato",
        "german-pink-tomato",
        "polish-linguisa-tomato",
        "tappys-finest-tomato",
        "aussie-tomato",
        "dester-tomato",
        "ten-fingers-of-naples-tomato",
        "san-marzano-redorta-tomato",
        "bloody-butcher-tomato",
        "burpees-big-boy-tomato",
        "fourth-of-july-tomato",
        "health-kick-tomato",
        "sweet-million-tomato",
        "supersweet-100-tomato",
        "black-vernissage-tomato",
        "green-vernissage-tomato",
        "yellow-vernissage-tomato",
        "orange-banana-tomato",
        "pink-banana-tomato",
        "red-pear-tomato",
        "black-pear-tomato",
        "yellow-submarine-tomato",
        "reisetomate-tomato",
        "mexico-midget-tomato",
        "wapsipinicon-peach-tomato",
        "stump-of-the-world-tomato",
        "yoders-brandywine-tomato",
        "speckled-peach-tomato",
        "yoders-german-yellow-tomato",
        "black-from-tula-tomato",
        "black-zebra-tomato",
        "green-giant-tomato",
        "great-white-tomato",
        "snow-white-cherry-tomato",
        "blondkopfchen-tomato",
        "isis-candy-tomato",
        "chocolate-cherry-tomato",
        "indigo-cherry-drops-tomato",
        "indigo-blue-beauty-tomato",
        "indigo-apple-tomato",
        "indigo-pear-drops-tomato",
        "purple-bumblebee-tomato",
        "berkeley-tie-dye-green-tomato",
        "ananas-noire-bs-tomato",
        "amish-gold-slicer-tomato",
        "old-german-tomato",
        "hungarian-heart-tomato",
        "kosovo-tomato",
        "russian-rose-tomato",
        "rose-de-berne-tomato",
        "ferris-wheel-tomato",
        "valencia-tomato",
        "kelloggs-breakfast-yellow",
        "ozark-pink-tomato",
        "arkansas-marvel-tomato",
        "neves-azorean-red-tomato",
        "marianna-peace-tomato",
        "dr-wyche-yellow-tomato",
        "azoychka-tomato",
        "moskvich-tomato",
        "silvery-fir-tree-tomato",
        "ida-gold-tomato",
        "manitoba-tomato",
        "yellow-perfection-tomato",
        "yellow-brandywine-platfoot-tomato",
        "anna-banana-russian-tomato",
        "long-tom-tomato",
        "amish-paste-strain-tomato",
        "polish-giant-tomato",
        "rose-tomato",
        "tropic-tomato",
        "homestead-tomato",
        "florida-91-tomato",
        "phoenix-tomato",
        "solar-fire-tomato",
        "heat-master-tomato",
        "park-whopper-tomato",
        "defiant-tomato",
        "iron-lady-tomato",
        "mountain-merit-tomato",
        "plum-regal-tomato",
        "geronimo-tomato",
        "trust-tomato",
        "buffalosun-tomato",
        "rebelski-tomato",
        "bigdena-tomato",
        "panzer-tomato",
        "san-marzano-2-tomato",
        "san-marzano-gigante-tomato",
        "martinos-roma-tomato",
        "granadero-tomato",
        "ten-fingers-bauer-tomato",
        "andes-tomato",
        "amish-yellow-paste-tomato",
        "thessaloniki-tomato",
        "abe-lincoln-tomato",
        "trophy-tomato",
        "purple-calabash-tomato",
        "amana-orange-tomato",
        "abe-lincoln-improved-tomato",
        "ponderosa-pink-tomato",
        "winsall-tomato",
        "livingstons-globe-tomato",
        "livingstons-paragon-tomato",
        "matina-tomato",
        "valena-orange-tomato",
        "blue-beech-tomato",
        "purple-haze-tomato",
        "blue-cream-berries-tomato",
        "bosque-blue-tomato",
        "atomic-grape-tomato",
        "lucky-tiger-tomato",
        "marsala-tomato",
        "russian-purple-tomato",
        "schimmeig-creg-tomato",
        "ace-55-tomato",
        "campbell-1327-tomato",
        "long-keeper-tomato",
        "burgess-stuffing-tomato",
        "yellow-stuffer-tomato",
        "rouge-de-marmande-tomato",
        "marmande-vfa-tomato",
        "noire-de-crimee-tomato",
        "coeur-de-boeuf-tomato",
        "andine-cornue-tomato",
        "rosalita-grape-tomato",
        "five-star-grape-tomato",
        "midnight-snack-tomato",
        "midnight-roma-tomato",
        "jasper-tomato",
        "esterina-tomato",
        "honeycomb-tomato",
        "sakura-tomato",
        "sweet-treats-tomato",
        "favorita-tomato",
        "nepal-tomato",
        "hawaiian-pineapple-tomato",
        "old-virginia-tomato",
        "true-black-brandywine-tomato",
        "pruden-purple-tomato",
        "limmony-tomato",
        "honey-delight-tomato",
        "barlow-jap-tomato",
        "rebel-yell-tomato",
        "egg-yolk-tomato",
        "barnes-mountain-yellow-tomato",
        "yellow-mortgage-lifter-tomato",
        "neasy-tomato",
        "patio-tomato",
        "tumbler-tomato",
        "tiny-tim-tomato",
        "micro-tom-tomato",
        "pepper-urfa-biber",
        "pepper-espelette",
        "pepper-guajillo",
        "pepper-cascabel",
        "pepper-chiltepin",
        "pepper-korean-gochugaru",
        "pepper-sichuan-facing-heaven",
        "pepper-birds-eye",
        "pepper-piri-piri",
        "pepper-jalapeno-early",
        "pepper-jaloro",
        "pepper-mucho-nacho",
        "pepper-felicity",
        "pepper-tam-jalapeno",
        "pepper-hatch-mild",
        "pepper-hatch-medium",
        "pepper-hatch-hot",
        "pepper-nm-big-jim",
        "pepper-mirasol",
        "pepper-habanero-red-savina",
        "pepper-habanero-chocolate",
        "pepper-habanero-orange",